{
  "$schema": "https://shadcn-svelte.com/schema/registry.json",
  "name": "Ori UI",
  "homepage": "https://oriui.app",
  "aliases": {
    "lib": "$lib",
    "components": "$lib/components",
    "utils": "$lib/utils/utils",
    "ui": "$lib/components/ui",
    "hooks": "$lib/hooks"
  },
  "items": [
    {
      "name": "copy-button",
      "type": "registry:block",
      "title": "Copy Button",
      "description": "",
      "registryDependencies": [
        "button"
      ],
      "dependencies": [],
      "files": [
        {
          "path": "src/lib/registry/buttons/copy-button/copy-button.svelte",
          "type": "registry:file",
          "target": "ori/copy-button/copy-button.svelte"
        },
        {
          "path": "src/lib/registry/buttons/copy-button/index.ts",
          "type": "registry:file",
          "target": "ori/copy-button/index.ts"
        }
      ],
      "author": "Chirag Arora <arorachirag12005@gmail.com>",
      "meta": {
        "author": "TheChirag356",
        "version": "1.0.0",
        "documentation": "https://oriui.app/components/copy-button",
        "repository": "https://github.com/TheChirag356/ori-ui"
      }
    },
    {
      "name": "interactive-hover-button",
      "type": "registry:block",
      "title": "Interactive Hover Button",
      "description": "",
      "registryDependencies": [],
      "dependencies": [
        "@tabler/icons-svelte"
      ],
      "files": [
        {
          "path": "src/lib/registry/buttons/interactive-hover-button/index.ts",
          "type": "registry:file",
          "target": "ori/interactive-hover-button/index.ts"
        },
        {
          "path": "src/lib/registry/buttons/interactive-hover-button/interactive-hover-button.svelte",
          "type": "registry:file",
          "target": "ori/interactive-hover-button/interactive-hover-button.svelte"
        }
      ],
      "author": "Chirag Arora <arorachirag12005@gmail.com>",
      "meta": {
        "author": "TheChirag356",
        "version": "1.0.0",
        "documentation": "https://oriui.app/components/interactive-hover-button",
        "repository": "https://github.com/TheChirag356/ori-ui"
      }
    },
    {
      "name": "ios-toggle-button",
      "type": "registry:block",
      "title": "Ios Toggle Button",
      "description": "",
      "registryDependencies": [],
      "dependencies": [],
      "files": [
        {
          "path": "src/lib/registry/buttons/ios-toggle-button/index.ts",
          "type": "registry:file",
          "target": "ori/ios-toggle-button/index.ts"
        },
        {
          "path": "src/lib/registry/buttons/ios-toggle-button/ios-toggle-button.svelte",
          "type": "registry:file",
          "target": "ori/ios-toggle-button/ios-toggle-button.svelte"
        }
      ],
      "author": "Chirag Arora <arorachirag12005@gmail.com>",
      "meta": {
        "author": "TheChirag356",
        "version": "1.0.0",
        "documentation": "https://oriui.app/components/ios-toggle-button",
        "repository": "https://github.com/TheChirag356/ori-ui"
      }
    },
    {
      "name": "liquid-button",
      "type": "registry:block",
      "title": "Liquid Button",
      "description": "",
      "registryDependencies": [
        "button"
      ],
      "dependencies": [
        "tailwind-variants"
      ],
      "files": [
        {
          "path": "src/lib/registry/buttons/liquid-button/index.ts",
          "type": "registry:file",
          "target": "ori/liquid-button/index.ts"
        },
        {
          "path": "src/lib/registry/buttons/liquid-button/liquid-button.svelte",
          "type": "registry:file",
          "target": "ori/liquid-button/liquid-button.svelte"
        }
      ],
      "author": "Chirag Arora <arorachirag12005@gmail.com>",
      "meta": {
        "author": "TheChirag356",
        "version": "1.0.0",
        "documentation": "https://oriui.app/components/liquid-button",
        "repository": "https://github.com/TheChirag356/ori-ui"
      }
    },
    {
      "name": "moving-border-button",
      "type": "registry:block",
      "title": "Moving Border Button",
      "description": "",
      "registryDependencies": [
        "button"
      ],
      "dependencies": [],
      "files": [
        {
          "path": "src/lib/registry/buttons/moving-border-button/index.ts",
          "type": "registry:file",
          "target": "ori/moving-border-button/index.ts"
        },
        {
          "path": "src/lib/registry/buttons/moving-border-button/moving-border-button.svelte",
          "type": "registry:file",
          "target": "ori/moving-border-button/moving-border-button.svelte"
        }
      ],
      "author": "Chirag Arora <arorachirag12005@gmail.com>",
      "meta": {
        "author": "TheChirag356",
        "version": "1.0.0",
        "documentation": "https://oriui.app/components/moving-border-button",
        "repository": "https://github.com/TheChirag356/ori-ui"
      }
    },
    {
      "name": "pulsating-button",
      "type": "registry:block",
      "title": "Pulsating Button",
      "description": "",
      "registryDependencies": [
        "button"
      ],
      "dependencies": [],
      "files": [
        {
          "path": "src/lib/registry/buttons/pulsating-button/index.ts",
          "type": "registry:file",
          "target": "ori/pulsating-button/index.ts"
        },
        {
          "path": "src/lib/registry/buttons/pulsating-button/pulsating-button.svelte",
          "type": "registry:file",
          "target": "ori/pulsating-button/pulsating-button.svelte"
        }
      ],
      "author": "Chirag Arora <arorachirag12005@gmail.com>",
      "meta": {
        "author": "TheChirag356",
        "version": "1.0.0",
        "documentation": "https://oriui.app/components/pulsating-button",
        "repository": "https://github.com/TheChirag356/ori-ui"
      }
    },
    {
      "name": "rainbow-button",
      "type": "registry:block",
      "title": "Rainbow Button",
      "description": "",
      "registryDependencies": [
        "button"
      ],
      "dependencies": [],
      "files": [
        {
          "path": "src/lib/registry/buttons/rainbow-button/index.ts",
          "type": "registry:file",
          "target": "ori/rainbow-button/index.ts"
        },
        {
          "path": "src/lib/registry/buttons/rainbow-button/rainbow-button.svelte",
          "type": "registry:file",
          "target": "ori/rainbow-button/rainbow-button.svelte"
        }
      ],
      "author": "Chirag Arora <arorachirag12005@gmail.com>",
      "meta": {
        "author": "TheChirag356",
        "version": "1.0.0",
        "documentation": "https://oriui.app/components/rainbow-button",
        "repository": "https://github.com/TheChirag356/ori-ui"
      }
    },
    {
      "name": "ripple-button",
      "type": "registry:block",
      "title": "Ripple Button",
      "description": "",
      "registryDependencies": [
        "button"
      ],
      "dependencies": [],
      "files": [
        {
          "path": "src/lib/registry/buttons/ripple-button/index.ts",
          "type": "registry:file",
          "target": "ori/ripple-button/index.ts"
        },
        {
          "path": "src/lib/registry/buttons/ripple-button/ripple-button.svelte",
          "type": "registry:file",
          "target": "ori/ripple-button/ripple-button.svelte"
        }
      ],
      "author": "Chirag Arora <arorachirag12005@gmail.com>",
      "meta": {
        "author": "TheChirag356",
        "version": "1.0.0",
        "documentation": "https://oriui.app/components/ripple-button",
        "repository": "https://github.com/TheChirag356/ori-ui"
      }
    },
    {
      "name": "slide-text-button",
      "type": "registry:block",
      "title": "Slide Text Button",
      "description": "",
      "registryDependencies": [
        "button"
      ],
      "dependencies": [],
      "files": [
        {
          "path": "src/lib/registry/buttons/slide-text-button/index.ts",
          "type": "registry:file",
          "target": "ori/slide-text-button/index.ts"
        },
        {
          "path": "src/lib/registry/buttons/slide-text-button/slide-text-button.svelte",
          "type": "registry:file",
          "target": "ori/slide-text-button/slide-text-button.svelte"
        }
      ],
      "author": "Chirag Arora <arorachirag12005@gmail.com>",
      "meta": {
        "author": "TheChirag356",
        "version": "1.0.0",
        "documentation": "https://oriui.app/components/slide-text-button",
        "repository": "https://github.com/TheChirag356/ori-ui"
      }
    },
    {
      "name": "browser-window",
      "type": "registry:block",
      "title": "Browser Window",
      "description": "",
      "registryDependencies": [],
      "dependencies": [],
      "files": [
        {
          "path": "src/lib/registry/components/browser-window/browser-window.svelte",
          "type": "registry:file",
          "target": "ori/browser-window/browser-window.svelte"
        },
        {
          "path": "src/lib/registry/components/browser-window/index.ts",
          "type": "registry:file",
          "target": "ori/browser-window/index.ts"
        }
      ],
      "author": "Chirag Arora <arorachirag12005@gmail.com>",
      "meta": {
        "author": "TheChirag356",
        "version": "1.0.0",
        "documentation": "https://oriui.app/components/browser-window",
        "repository": "https://github.com/TheChirag356/ori-ui"
      }
    },
    {
      "name": "code-block",
      "type": "registry:block",
      "title": "Code Block",
      "description": "",
      "registryDependencies": [],
      "dependencies": [
        "shiki"
      ],
      "files": [
        {
          "path": "src/lib/registry/components/code-block/index.ts",
          "type": "registry:file",
          "target": "ori/code-block/index.ts"
        },
        {